{"fixture_id":"xinsight.draft-evidence.streaming-terminal-usage","fixture_version":"1.0.0","origin":{"kind":"synthetic_contract_fixture"},"expectation":{"result":"accept"},"capability_claim_boundary":"conformance_only_not_unirouter_capability_or_release_evidence","scenario_id":"streaming-terminal-usage","evidence":{"schema_id":"urn:x-insight:incubation:unirouter-execution-evidence-consumer-candidate:0.1.0","schema_version":"0.1.0-draft","ownership":"x-insight-consumer-side-incubation-candidate","source_authority_status":"undefined","runtime_eligible":false,"compatibility_commitment":"none","replaces_completed_execution_v1":false,"execution_identity":{"execution_id":"exec-stream-1","source_fact_identity":"source:exec:stream-1","idempotency_key":"exec:stream-1"},"operation":{"family":"messages","protocol_profile":"unirouter.anthropic.messages.text-tools.v3","protocol_version":"1.0.0-observed-unreleased","capability_type":"streaming-text","execution_profile":"unirouter.execution-route.v2","execution_profile_version":"2.0.0-observed-unreleased"},"capability_evidence":{"status":"known","reference":"source:capability:messages-stream","reference_sha256":"sha256:bbbbbbbbbbbbbbbbbbbbbbbbbbbbbbbbbbbbbbbbbbbbbbbbbbbbbbbbbbbbbbbb"},"attempts":[{"attempt_id":"attempt-1","ordinal":1,"route":"primary","provider":"provider-a","status":"succeeded"}],"facts":[{"fact_id":"terminal","kind":"terminal_outcome","sequence":1,"lifecycle":"terminal","value":{"status":"settled","stream_final":true},"provenance":{"mode":"direct","source_fact_identity":"source:terminal:stream-1"},"relationships":[]},{"fact_id":"usage","kind":"usage","sequence":2,"lifecycle":"terminal","value":{"input_tokens":10,"output_tokens":5,"finality":"terminal"},"provenance":{"mode":"direct","source_fact_identity":"source:usage:stream-1"},"relationships":[{"type":"relates_to","target_fact_id":"terminal","source_declared":true,"source_event_identity":"source:terminal:stream-1"}]}],"gaps":[],"delivery":{"delivery_count":1,"business_fact_count":2}}}
