{"fixture_id":"xinsight.draft-evidence.tool-choice","fixture_version":"1.0.0","origin":{"kind":"synthetic_contract_fixture"},"expectation":{"result":"accept"},"capability_claim_boundary":"conformance_only_not_unirouter_capability_or_release_evidence","scenario_id":"tool-choice","evidence":{"schema_id":"urn:x-insight:incubation:unirouter-execution-evidence-consumer-candidate:0.1.0","schema_version":"0.1.0-draft","ownership":"x-insight-consumer-side-incubation-candidate","source_authority_status":"undefined","runtime_eligible":false,"compatibility_commitment":"none","replaces_completed_execution_v1":false,"execution_identity":{"execution_id":"exec-tool-1","source_fact_identity":"source:exec:tool-1","idempotency_key":"exec:tool-1"},"operation":{"family":"messages","protocol_profile":"unirouter.anthropic.messages.text-tools.v3","protocol_version":"1.0.0-observed-unreleased","capability_type":"tools","execution_profile":"unirouter.execution-route.v2","execution_profile_version":"2.0.0-observed-unreleased"},"capability_evidence":{"status":"known","reference":"source:capability:tools","reference_sha256":"sha256:dddddddddddddddddddddddddddddddddddddddddddddddddddddddddddddddd"},"attempts":[{"attempt_id":"attempt-1","ordinal":1,"route":"primary","provider":"provider-a","status":"succeeded"}],"facts":[{"fact_id":"tool","kind":"tool_choice","sequence":1,"lifecycle":"attempt","value":{"mode":"required","tool_count":1},"provenance":{"mode":"direct","source_fact_identity":"source:tool-choice:1"},"relationships":[]},{"fact_id":"terminal","kind":"terminal_outcome","sequence":2,"lifecycle":"terminal","value":{"status":"settled"},"provenance":{"mode":"direct","source_fact_identity":"source:terminal:tool-1"},"relationships":[{"type":"relates_to","target_fact_id":"tool","source_declared":true,"source_event_identity":"source:terminal:tool-1"}]}],"gaps":[],"delivery":{"delivery_count":1,"business_fact_count":2}}}
