{"fixture_id":"xinsight.draft-evidence.duplicate-delivery","fixture_version":"1.0.0","origin":{"kind":"synthetic_contract_fixture"},"expectation":{"result":"accept"},"capability_claim_boundary":"conformance_only_not_unirouter_capability_or_release_evidence","scenario_id":"duplicate-delivery","evidence":{"schema_id":"urn:x-insight:incubation:unirouter-execution-evidence-consumer-candidate:0.1.0","schema_version":"0.1.0-draft","ownership":"x-insight-consumer-side-incubation-candidate","source_authority_status":"undefined","runtime_eligible":false,"compatibility_commitment":"none","replaces_completed_execution_v1":false,"execution_identity":{"execution_id":"exec-duplicate-1","source_fact_identity":"source:exec:duplicate-1","idempotency_key":"exec:duplicate-1"},"operation":{"family":"messages","protocol_profile":"unirouter.anthropic.messages.text-tools.v3","protocol_version":"1.0.0-observed-unreleased","capability_type":"text","execution_profile":"unirouter.execution-route.v2","execution_profile_version":"2.0.0-observed-unreleased"},"capability_evidence":{"status":"unknown","reference":null},"attempts":[{"attempt_id":"attempt-1","ordinal":1,"route":"primary","provider":"provider-a","status":"succeeded"}],"facts":[{"fact_id":"terminal","kind":"terminal_outcome","sequence":1,"lifecycle":"terminal","value":{"status":"settled"},"provenance":{"mode":"direct","source_fact_identity":"source:terminal:duplicate-1"},"relationships":[]}],"gaps":[{"path":"/capability_evidence","state":"unknown","reason":"delivery conformance does not establish support"}],"delivery":{"delivery_count":2,"business_fact_count":1}}}
