{"fixture_id":"xinsight.draft-evidence.single-attempt-success","fixture_version":"1.0.0","origin":{"kind":"source_derived","source":{"repository":"https://github.com/foigent/unirouter","ref":"f3a73f3cd84cf4c75e9a4159dbe1831d9c517379","commit":"f3a73f3cd84cf4c75e9a4159dbe1831d9c517379","tree":"ce36a61e0027513b9f668dda6229a8d5d0590de7","path":"contracts/completed-execution/v1/fixtures/valid-settled.json","version":"unirouter.completed-execution.v1","content_sha256":"sha256:5e9eda0a2630d52c5589d38b8ec480604c47c2cc77391b75a57b2a159db6dd27"}},"expectation":{"result":"accept"},"capability_claim_boundary":"conformance_only_not_unirouter_capability_or_release_evidence","scenario_id":"single-attempt-success","v1_differential":{"source_path":"contracts/completed-execution/v1/fixtures/valid-settled.json","source_content_sha256":"sha256:5e9eda0a2630d52c5589d38b8ec480604c47c2cc77391b75a57b2a159db6dd27","mapping":{"terminal_outcome":"same_source_fact","execution_identity":"same_source_fact","usage":"same_source_fact","cost":"same_source_fact","pricing_finality":"preserved","post_terminal_facts":"separate_lifecycle_fact","duplicate_delivery":"same_business_identity","gaps":"never_filled_without_source"}},"evidence":{"schema_id":"urn:x-insight:incubation:unirouter-execution-evidence-consumer-candidate:0.1.0","schema_version":"0.1.0-draft","ownership":"x-insight-consumer-side-incubation-candidate","source_authority_status":"undefined","runtime_eligible":false,"compatibility_commitment":"none","replaces_completed_execution_v1":false,"execution_identity":{"execution_id":"req_feed_v1_settled","source_fact_identity":"unirouter.completed-execution.v1:req_feed_v1_settled","idempotency_key":"unirouter.completed-execution.v1:req_feed_v1_settled"},"operation":{"family":"chat","protocol_profile":"unirouter.completed-execution.v1","protocol_version":"1","capability_type":"terminal-billing-snapshot","execution_profile":"unirouter.completed-execution.v1","execution_profile_version":"1"},"capability_evidence":{"status":"known","reference":"contracts/completed-execution/v1/fixtures/valid-settled.json","reference_sha256":"sha256:5e9eda0a2630d52c5589d38b8ec480604c47c2cc77391b75a57b2a159db6dd27"},"attempts":[{"attempt_id":"attempt-1","ordinal":1,"route":"source-declared","provider":"source-declared","status":"succeeded"}],"facts":[{"fact_id":"terminal","kind":"terminal_outcome","sequence":1,"lifecycle":"terminal","value":{"status":"settled"},"provenance":{"mode":"direct","source_fact_identity":"unirouter.completed-execution.v1:req_feed_v1_settled"},"relationships":[]},{"fact_id":"usage","kind":"usage","sequence":2,"lifecycle":"terminal","value":{"prompt_tokens":8,"completion_tokens":3},"provenance":{"mode":"direct","source_fact_identity":"unirouter.completed-execution.v1:req_feed_v1_settled:usage"},"relationships":[{"type":"relates_to","target_fact_id":"terminal","source_declared":true,"source_event_identity":"unirouter.completed-execution.v1:req_feed_v1_settled"}]},{"fact_id":"cost","kind":"cost","sequence":3,"lifecycle":"terminal","value":{"charged_cost_micros":"17","pricing_version":"pricing-v1","pricing_finality":"source_final"},"provenance":{"mode":"direct","source_fact_identity":"unirouter.completed-execution.v1:req_feed_v1_settled:money"},"relationships":[{"type":"relates_to","target_fact_id":"terminal","source_declared":true,"source_event_identity":"unirouter.completed-execution.v1:req_feed_v1_settled"}]}],"gaps":[],"delivery":{"delivery_count":1,"business_fact_count":3}}}
