{"fixture_id":"xinsight.draft-evidence.revision-of","fixture_version":"1.0.0","origin":{"kind":"synthetic_contract_fixture"},"expectation":{"result":"accept"},"capability_claim_boundary":"conformance_only_not_unirouter_capability_or_release_evidence","scenario_id":"revision-of","evidence":{"schema_id":"urn:x-insight:incubation:unirouter-execution-evidence-consumer-candidate:0.1.0","schema_version":"0.1.0-draft","ownership":"x-insight-consumer-side-incubation-candidate","source_authority_status":"undefined","runtime_eligible":false,"compatibility_commitment":"none","replaces_completed_execution_v1":false,"execution_identity":{"execution_id":"exec-revision-1","source_fact_identity":"source:exec:revision-1","idempotency_key":"exec:revision-1"},"operation":{"family":"responses","protocol_profile":"unirouter.openai.responses.text.v2","protocol_version":"1.0.0-observed-unreleased","capability_type":"text","execution_profile":"unirouter.execution-route.v2","execution_profile_version":"2.0.0-observed-unreleased"},"capability_evidence":{"status":"unknown","reference":null},"attempts":[{"attempt_id":"attempt-1","ordinal":1,"route":"primary","provider":"provider-a","status":"succeeded"}],"facts":[{"fact_id":"usage-r1","kind":"usage","sequence":1,"lifecycle":"terminal","value":{"input_tokens":4,"source_revision":1},"provenance":{"mode":"direct","source_fact_identity":"source:usage:revision-1"},"relationships":[]},{"fact_id":"usage-r2","kind":"usage","sequence":2,"lifecycle":"correction","value":{"input_tokens":5,"source_revision":2},"provenance":{"mode":"source_declared","source_fact_identity":"source:usage:revision-1"},"relationships":[{"type":"revision_of","target_fact_id":"usage-r1","source_declared":true,"source_event_identity":"source:usage:revision-1","reason":"Source issued revision two"}]},{"fact_id":"terminal","kind":"terminal_outcome","sequence":3,"lifecycle":"terminal","value":{"status":"settled"},"provenance":{"mode":"direct","source_fact_identity":"source:terminal:revision-1"},"relationships":[]}],"gaps":[{"path":"/capability_evidence","state":"unknown","reason":"revision conformance does not establish support"}],"delivery":{"delivery_count":1,"business_fact_count":3}}}
