{"fixture_id":"xinsight.draft-evidence.gap-unknown","fixture_version":"1.0.0","origin":{"kind":"hypothesis_only"},"expectation":{"result":"accept"},"capability_claim_boundary":"conformance_only_not_unirouter_capability_or_release_evidence","scenario_id":"gap-unknown","evidence":{"schema_id":"urn:x-insight:incubation:unirouter-execution-evidence-consumer-candidate:0.1.0","schema_version":"0.1.0-draft","ownership":"x-insight-consumer-side-incubation-candidate","source_authority_status":"undefined","runtime_eligible":false,"compatibility_commitment":"none","replaces_completed_execution_v1":false,"execution_identity":{"execution_id":"exec-gap-1","source_fact_identity":"source:exec:gap-1","idempotency_key":"exec:gap-1"},"operation":{"family":"chat","protocol_profile":"unirouter.openai.chat-completions.text.v1","protocol_version":"1.0.0-hypothesis","capability_type":"text","execution_profile":"unirouter.execution-route.v2","execution_profile_version":"2.0.0-observed-unreleased"},"capability_evidence":{"status":"unknown","reference":null},"attempts":[{"attempt_id":"attempt-1","ordinal":1,"route":"unknown","provider":"unknown","status":"succeeded"}],"facts":[{"fact_id":"terminal","kind":"terminal_outcome","sequence":1,"lifecycle":"terminal","value":{"status":"settled"},"provenance":{"mode":"direct","source_fact_identity":"source:terminal:gap-1"},"relationships":[]},{"fact_id":"usage-gap","kind":"gap","sequence":2,"lifecycle":"terminal","unknown_reason":"terminal usage unavailable from Source","provenance":{"mode":"direct","source_fact_identity":"source:gap:usage-1"},"relationships":[{"type":"relates_to","target_fact_id":"terminal","source_declared":true,"source_event_identity":"source:terminal:gap-1"}]}],"gaps":[{"path":"/facts/usage","state":"gap","reason":"terminal usage unavailable from Source"},{"path":"/capability_evidence","state":"unknown","reason":"hypothesis fixture does not establish support"}],"delivery":{"delivery_count":1,"business_fact_count":2}}}
