{"fixture_id":"xinsight.draft-evidence.reasoning-evidence","fixture_version":"1.0.0","origin":{"kind":"synthetic_contract_fixture"},"expectation":{"result":"accept"},"capability_claim_boundary":"conformance_only_not_unirouter_capability_or_release_evidence","scenario_id":"reasoning-evidence","evidence":{"schema_id":"urn:x-insight:incubation:unirouter-execution-evidence-consumer-candidate:0.1.0","schema_version":"0.1.0-draft","ownership":"x-insight-consumer-side-incubation-candidate","source_authority_status":"undefined","runtime_eligible":false,"compatibility_commitment":"none","replaces_completed_execution_v1":false,"execution_identity":{"execution_id":"exec-reasoning-1","source_fact_identity":"source:exec:reasoning-1","idempotency_key":"exec:reasoning-1"},"operation":{"family":"responses","protocol_profile":"unirouter.openai.responses.text.v2","protocol_version":"1.0.0-observed-unreleased","capability_type":"reasoning","execution_profile":"unirouter.execution-route.v2","execution_profile_version":"2.0.0-observed-unreleased"},"capability_evidence":{"status":"known","reference":"source:capability:reasoning","reference_sha256":"sha256:cccccccccccccccccccccccccccccccccccccccccccccccccccccccccccccccc"},"attempts":[{"attempt_id":"attempt-1","ordinal":1,"route":"primary","provider":"provider-a","status":"succeeded"}],"facts":[{"fact_id":"reasoning","kind":"reasoning","sequence":1,"lifecycle":"attempt","value":{"observed":true,"raw_content_captured":false},"provenance":{"mode":"direct","source_fact_identity":"source:reasoning:1"},"relationships":[]},{"fact_id":"terminal","kind":"terminal_outcome","sequence":2,"lifecycle":"terminal","value":{"status":"settled"},"provenance":{"mode":"direct","source_fact_identity":"source:terminal:reasoning-1"},"relationships":[{"type":"relates_to","target_fact_id":"reasoning","source_declared":true,"source_event_identity":"source:terminal:reasoning-1"}]}],"gaps":[],"delivery":{"delivery_count":1,"business_fact_count":2}}}
