{"fixture_id":"xinsight.draft-evidence.predispatch-denied","fixture_version":"1.0.0","origin":{"kind":"synthetic_contract_fixture"},"expectation":{"result":"accept"},"capability_claim_boundary":"conformance_only_not_unirouter_capability_or_release_evidence","scenario_id":"predispatch-denied","evidence":{"schema_id":"urn:x-insight:incubation:unirouter-execution-evidence-consumer-candidate:0.1.0","schema_version":"0.1.0-draft","ownership":"x-insight-consumer-side-incubation-candidate","source_authority_status":"undefined","runtime_eligible":false,"compatibility_commitment":"none","replaces_completed_execution_v1":false,"execution_identity":{"execution_id":"exec-denied-1","source_fact_identity":"source:decision:denied-1","idempotency_key":"decision:denied-1"},"operation":{"family":"predispatch","protocol_profile":"unirouter.policy-predispatch.v1","protocol_version":"1.0.0-observed-unreleased","capability_type":"policy_decision","execution_profile":"unirouter.execution-route.v2","execution_profile_version":"2.0.0-observed-unreleased"},"capability_evidence":{"status":"gap","reference":null},"attempts":[],"facts":[{"fact_id":"denial","kind":"predispatch_outcome","sequence":1,"lifecycle":"predispatch","value":{"status":"denied"},"provenance":{"mode":"direct","source_fact_identity":"source:decision:denied-1"},"relationships":[]}],"gaps":[{"path":"/attempts","state":"gap","reason":"predispatch denial prevented provider attempt"}],"delivery":{"delivery_count":1,"business_fact_count":1}}}
