{"fixture_id":"xinsight.draft-evidence.source-derived-from","fixture_version":"1.0.0","origin":{"kind":"synthetic_contract_fixture"},"expectation":{"result":"accept"},"capability_claim_boundary":"conformance_only_not_unirouter_capability_or_release_evidence","scenario_id":"source-derived-from","evidence":{"schema_id":"urn:x-insight:incubation:unirouter-execution-evidence-consumer-candidate:0.1.0","schema_version":"0.1.0-draft","ownership":"x-insight-consumer-side-incubation-candidate","source_authority_status":"undefined","runtime_eligible":false,"compatibility_commitment":"none","replaces_completed_execution_v1":false,"execution_identity":{"execution_id":"exec-derived-1","source_fact_identity":"source:exec:derived-1","idempotency_key":"exec:derived-1"},"operation":{"family":"responses","protocol_profile":"unirouter.openai.responses.text.v2","protocol_version":"1.0.0-observed-unreleased","capability_type":"text","execution_profile":"unirouter.execution-route.v2","execution_profile_version":"2.0.0-observed-unreleased"},"capability_evidence":{"status":"unknown","reference":null},"attempts":[{"attempt_id":"attempt-1","ordinal":1,"route":"primary","provider":"provider-a","status":"succeeded"}],"facts":[{"fact_id":"upstream","kind":"usage","sequence":1,"lifecycle":"terminal","value":{"input_tokens":4},"provenance":{"mode":"source_declared","source_fact_identity":"source:usage:upstream-1"},"relationships":[]},{"fact_id":"derived","kind":"cost","sequence":2,"lifecycle":"terminal","value":{"amount_micros":"8","source_declared_derivation":true},"provenance":{"mode":"source_declared","source_fact_identity":"source:cost:derived-1"},"relationships":[{"type":"derived_from","target_fact_id":"upstream","source_declared":true,"source_event_identity":"source:usage:upstream-1"}]},{"fact_id":"terminal","kind":"terminal_outcome","sequence":3,"lifecycle":"terminal","value":{"status":"settled"},"provenance":{"mode":"direct","source_fact_identity":"source:terminal:derived-1"},"relationships":[]}],"gaps":[{"path":"/capability_evidence","state":"unknown","reason":"derivation conformance does not establish support"}],"delivery":{"delivery_count":1,"business_fact_count":3}}}
