{"fixture_id":"xinsight.draft-evidence.retry","fixture_version":"1.0.0","origin":{"kind":"synthetic_contract_fixture"},"expectation":{"result":"accept"},"capability_claim_boundary":"conformance_only_not_unirouter_capability_or_release_evidence","scenario_id":"retry","evidence":{"schema_id":"urn:x-insight:incubation:unirouter-execution-evidence-consumer-candidate:0.1.0","schema_version":"0.1.0-draft","ownership":"x-insight-consumer-side-incubation-candidate","source_authority_status":"undefined","runtime_eligible":false,"compatibility_commitment":"none","replaces_completed_execution_v1":false,"execution_identity":{"execution_id":"exec-retry-1","source_fact_identity":"source:exec:retry-1","idempotency_key":"exec:retry-1"},"operation":{"family":"responses","protocol_profile":"unirouter.openai.responses.text.v2","protocol_version":"1.0.0-observed-unreleased","capability_type":"text","execution_profile":"unirouter.execution-route.v2","execution_profile_version":"2.0.0-observed-unreleased"},"capability_evidence":{"status":"known","reference":"source:capability:responses","reference_sha256":"sha256:aaaaaaaaaaaaaaaaaaaaaaaaaaaaaaaaaaaaaaaaaaaaaaaaaaaaaaaaaaaaaaaa"},"attempts":[{"attempt_id":"attempt-1","ordinal":1,"route":"primary","provider":"provider-a","status":"failed"},{"attempt_id":"attempt-2","ordinal":2,"route":"primary","provider":"provider-a","status":"succeeded"}],"facts":[{"fact_id":"terminal","kind":"terminal_outcome","sequence":1,"lifecycle":"terminal","value":{"status":"settled"},"provenance":{"mode":"direct","source_fact_identity":"source:terminal:retry-1"},"relationships":[]}],"gaps":[],"delivery":{"delivery_count":1,"business_fact_count":1}}}
