{"fixture_id":"xinsight.draft-evidence.reconciliation-after-terminal","fixture_version":"1.0.0","origin":{"kind":"synthetic_contract_fixture"},"expectation":{"result":"accept"},"capability_claim_boundary":"conformance_only_not_unirouter_capability_or_release_evidence","scenario_id":"reconciliation-after-terminal","evidence":{"schema_id":"urn:x-insight:incubation:unirouter-execution-evidence-consumer-candidate:0.1.0","schema_version":"0.1.0-draft","ownership":"x-insight-consumer-side-incubation-candidate","source_authority_status":"undefined","runtime_eligible":false,"compatibility_commitment":"none","replaces_completed_execution_v1":false,"execution_identity":{"execution_id":"exec-reconcile-1","source_fact_identity":"source:exec:reconcile-1","idempotency_key":"exec:reconcile-1"},"operation":{"family":"responses","protocol_profile":"unirouter.openai.responses.text.v2","protocol_version":"1.0.0-observed-unreleased","capability_type":"text","execution_profile":"unirouter.execution-route.v2","execution_profile_version":"2.0.0-observed-unreleased"},"capability_evidence":{"status":"unknown","reference":null},"attempts":[{"attempt_id":"attempt-1","ordinal":1,"route":"primary","provider":"provider-a","status":"succeeded"}],"facts":[{"fact_id":"terminal","kind":"terminal_outcome","sequence":1,"lifecycle":"terminal","value":{"status":"settled"},"provenance":{"mode":"direct","source_fact_identity":"source:terminal:reconcile-1"},"relationships":[]},{"fact_id":"cost","kind":"cost","sequence":2,"lifecycle":"terminal","value":{"charged_cost_micros":"100","pricing_finality":"source_final"},"provenance":{"mode":"direct","source_fact_identity":"source:cost:reconcile-1"},"relationships":[{"type":"relates_to","target_fact_id":"terminal","source_declared":true,"source_event_identity":"source:terminal:reconcile-1"}]},{"fact_id":"reconciliation","kind":"reconciliation","sequence":3,"lifecycle":"post_terminal","value":{"delta_micros":"20","action":"supplemental_charge"},"provenance":{"mode":"direct","source_fact_identity":"source:reconciliation:1"},"relationships":[{"type":"relates_to","target_fact_id":"cost","source_declared":true,"source_event_identity":"source:cost:reconcile-1"}]}],"gaps":[{"path":"/capability_evidence","state":"unknown","reason":"synthetic lifecycle case is not capability evidence"}],"delivery":{"delivery_count":1,"business_fact_count":3}}}
