{"fixture_id":"xinsight.draft-evidence.source-caused-by","fixture_version":"1.0.0","origin":{"kind":"synthetic_contract_fixture"},"expectation":{"result":"accept"},"capability_claim_boundary":"conformance_only_not_unirouter_capability_or_release_evidence","scenario_id":"source-caused-by","evidence":{"schema_id":"urn:x-insight:incubation:unirouter-execution-evidence-consumer-candidate:0.1.0","schema_version":"0.1.0-draft","ownership":"x-insight-consumer-side-incubation-candidate","source_authority_status":"undefined","runtime_eligible":false,"compatibility_commitment":"none","replaces_completed_execution_v1":false,"execution_identity":{"execution_id":"exec-cause-1","source_fact_identity":"source:exec:cause-1","idempotency_key":"exec:cause-1"},"operation":{"family":"responses","protocol_profile":"unirouter.openai.responses.text.v2","protocol_version":"1.0.0-observed-unreleased","capability_type":"text","execution_profile":"unirouter.execution-route.v2","execution_profile_version":"2.0.0-observed-unreleased"},"capability_evidence":{"status":"unknown","reference":null},"attempts":[{"attempt_id":"attempt-1","ordinal":1,"route":"primary","provider":"provider-a","status":"succeeded"}],"facts":[{"fact_id":"parent","kind":"tool_choice","sequence":1,"lifecycle":"attempt","value":{"tool":"source-declared"},"provenance":{"mode":"source_declared","source_fact_identity":"source:event:parent-1"},"relationships":[]},{"fact_id":"child","kind":"terminal_outcome","sequence":2,"lifecycle":"terminal","value":{"status":"settled"},"provenance":{"mode":"source_declared","source_fact_identity":"source:event:child-1"},"relationships":[{"type":"caused_by","target_fact_id":"parent","source_declared":true,"source_event_identity":"source:event:parent-1"}]}],"gaps":[{"path":"/capability_evidence","state":"unknown","reason":"relationship conformance does not establish support"}],"delivery":{"delivery_count":1,"business_fact_count":2}}}
